<?xml version="1.0" encoding="UTF-8" ?>
<!--
-->

<OpcodeData xmlns:xsi="http://www.w3.org/2001/XMLSchema-instance" xsi:noNamespaceSchemaLocation="./Opcodes.xsd">
  <Opcode Value='00' Function='NOP' Group='General' Length='1'>
    <Encoding Platform='z80'>
      <Mnemonic>NOP</Mnemonic>
      <Status>Documented</Status>
      <Cycles>1(4)</Cycles>
      <Flags>------</Flags>
      <Description>The CPU performs no operation during this machine cycle</Description>
    </Encoding>
  </Opcode>
  <Opcode Value='01' Function='LOAD' Group='16-Bit Load' Length='3'>
    <Encoding Platform='z80'>
      <Mnemonic>LD</Mnemonic>
      <Arguments>
        <Arg encoding='WordReg'>WordReg</Arg>
        <Arg encoding='WordImmidate'>Word</Arg>
      </Arguments>
      <Status>Documented</Status>
      <Cycles>2(10)</Cycles>
      <Flags>------</Flags>
      <Description>The 2-byte integer nn is loaded to the dd register pair</Description>
    </Encoding>
  </Opcode>
  <Opcode Value='02' Function='LOAD' Group='8-Bit Load' Length='1'>
    <Encoding Platform='z80'>
      <Mnemonic>LD</Mnemonic>
      <Arguments>
        <Arg encoding='WordReg'>WordRegPtr-BD</Arg>
        <Arg encoding='Direct'>ByteReg-A</Arg>
      </Arguments>
      <Status>Documented</Status>
      <Cycles>2(7)</Cycles>
      <Flags>------</Flags>
      <Description>The contents of the Accumulator are loaded to the memory location specified by the contents of the register pair.</Description>
    </Encoding>
  </Opcode>
  <Opcode Value='03' Function='INC' Group='16-Bit Arithmetic' Length='1'>
    <Encoding Platform='z80'>
      <Mnemonic>INC</Mnemonic>
      <Arguments>
        <Arg encoding='WordReg'>WordReg</Arg>
      </Arguments>
      <Status>Documented</Status>
      <Cycles>1(6)</Cycles>
      <Flags>------</Flags>
      <Description>The contents of register pair ss (any of register pairs BC, DE, HL, or SP) are incremented.</Description>
    </Encoding>
  </Opcode>
  <Opcode Value='04' Function='INC' Group='8-Bit Arithmetic' Length='1'>
    <Encoding Platform='z80'>
      <Mnemonic>INC</Mnemonic>
      <Arguments>
        <Arg encoding='Dest'>ByteReg</Arg>
      </Arguments>
      <Status>Documented</Status>
      <Cycles>1(4)</Cycles>
      <Flags>SZHP0-</Flags>
      <Description>Register r is incremented</Description>
    </Encoding>
  </Opcode>
  <Opcode Value='05' Function='DEC' Group='8-Bit Arithmetic' Length='1'>
    <Encoding Platform='z80'>
      <Mnemonic>DEC</Mnemonic>
      <Arguments>
        <Arg encoding='Dest'>ByteReg</Arg>
      </Arguments>
      <Status>Documented</Status>
      <Cycles>1(4)</Cycles>
      <Flags>SZHP1C</Flags>
      <Description>The byte specified by the m operand is decremented</Description>
    </Encoding>
  </Opcode>
  <Opcode Value='06' Function='LOAD' Group='8-Bit Load' Length='2'>
    <Encoding Platform='z80'>
      <Mnemonic>LD</Mnemonic>
      <Arguments>
        <Arg encoding='Dest'>ByteReg</Arg>
        <Arg encoding='ByteImmidate'>Byte</Arg>
      </Arguments>
      <Status>Documented</Status>
      <Cycles>2(7)</Cycles>
      <Flags>------</Flags>
      <Description>The 8-bit integer n is loaded to any register r.</Description>
    </Encoding>
  </Opcode>
  <Opcode Value='07' Function='RL' Group='Logical' Length='1'>
    <Encoding Preferred='true' Platform='z80'>
      <Mnemonic>RLCA</Mnemonic>
      <Arguments>
        <Arg encoding='Direct' hidden='true'>ByteReg-A</Arg>
      </Arguments>
      <Status>Documented</Status>
      <Cycles>1(4)</Cycles>
      <Flags>--0-0C</Flags>
      <Description>The contents of the Accumulator (register A) are rotated left 1-bit position. The sign bit (bit 7) is copied to the Carry flag and also to bit 0. Bit 0 is the least-significant bit.</Description>
    </Encoding>
    <Encoding Preferred='false' Platform='z80'>
      <Mnemonic>RLC</Mnemonic>
      <Arguments>
        <Arg encoding='Direct'>ByteReg-A</Arg>
      </Arguments>
      <Status>Documented</Status>
      <Cycles>1(4)</Cycles>
      <Flags>--0-0C</Flags>
      <Description>The contents of the Accumulator (register A) are rotated left 1-bit position. The sign bit (bit 7) is copied to the Carry flag and also to bit 0. Bit 0 is the least-significant bit.</Description>
    </Encoding>
  </Opcode>
  <Opcode Value='08' Function='EX' Group='16-Bit Load' Length='1'>
    <Encoding Platform='z80'>
      <Mnemonic>EX</Mnemonic>
      <Arguments>
        <Arg encoding='Direct'>WordReg-AF</Arg>
        <Arg encoding='Direct'>WordReg-AFAlt</Arg>
      </Arguments>
      <Status>Documented</Status>
      <Cycles>1(4)</Cycles>
      <Flags>------</Flags>
      <Description>The 2-byte contents of the register pairs AF and AF' are exchanged.</Description>
    </Encoding>
  </Opcode>
  <Opcode Value='09' Function='ADD' Group='16-Bit Arithmetic' Length='1'>
    <Encoding Platform='z80'>
      <Mnemonic>ADD</Mnemonic>
      <Arguments>
        <Arg encoding='Direct'>WordReg-HL</Arg>
        <Arg encoding='WordReg'>WordReg</Arg>
      </Arguments>
      <Status>Documented</Status>
      <Cycles>3(11)</Cycles>
      <Flags>--H-0C</Flags>
      <Description>The contents of register pair ss (any of register pairs BC, DE, HL, or SP) are added to the contents of register pair HL and the result is stored in HL</Description>
    </Encoding>
  </Opcode>
  <Opcode Value='0A' Function='LOAD' Group='8-Bit Load' Length='1'>
    <Encoding Platform='z80'>
      <Mnemonic>LD</Mnemonic>
      <Arguments>
        <Arg encoding='Direct'>ByteReg-A</Arg>
        <Arg encoding='WordReg'>WordRegPtr-BD</Arg>
      </Arguments>
      <Status>Documented</Status>
      <Cycles>2(7)</Cycles>
      <Flags>------</Flags>
      <Description>The contents of the memory location specified by the contents of the rr register pair are loaded to the Accumulator.</Description>
    </Encoding>
  </Opcode>
  <Opcode Value='0B' Function='DEC' Group='16-Bit Arithmetic' Length='1'>
    <Encoding Platform='z80'>
      <Mnemonic>DEC</Mnemonic>
      <Arguments>
        <Arg encoding='WordReg'>WordReg</Arg>
      </Arguments>
      <Status>Documented</Status>
      <Cycles>1(6)</Cycles>
      <Flags>------</Flags>
      <Description>The contents of register pair ss (any of the register pairs BC, DE, HL, or SP) are decremented.</Description>
    </Encoding>
  </Opcode>
  <Opcode Value='0F' Function='RR' Group='Logical' Length='1'>
    <Encoding Preferred='true' Platform='z80'>
      <Mnemonic>RRCA</Mnemonic>
      <Arguments>
        <Arg encoding='Direct' hidden='true'>ByteReg-A</Arg>
      </Arguments>
      <Status>Documented</Status>
      <Cycles>1(4)</Cycles>
      <Flags>--0-0C</Flags>
      <Description>The contents of the Accumulator (register A) are rotated right 1-bit position. Bit 0 is copied to the Carry flag and also to bit 7. Bit 0 is the least- significant bit.</Description>
    </Encoding>
  </Opcode>
  <Opcode Value='0F' Function='RR-CY' Group='Logical' Length='1'>
    <Encoding Preferred='false' Platform='z80'>
      <Mnemonic>RRC</Mnemonic>
      <Arguments>
        <Arg encoding='Direct'>ByteReg-A</Arg>
      </Arguments>
      <Status>Documented</Status>
      <Cycles>1(4)</Cycles>
      <Flags>--0-0C</Flags>
      <Description>The contents of the Accumulator (register A) are rotated right 1-bit position. Bit 0 is copied to the Carry flag and also to bit 7. Bit 0 is the least- significant bit.</Description>
    </Encoding>
  </Opcode>
  <Opcode Value='10' Function='DJNZ' Group='Branch' Length='2'>
    <Encoding Platform='z80'>
      <Mnemonic>DJNZ</Mnemonic>
      <Arguments>
        <Arg encoding='ByteImmidate'>Displacment</Arg>
      </Arguments>
      <Status>Documented</Status>
      <Cycles>3(13)</Cycles>
      <Flags>------</Flags>
      <Description>This instruction is similar to the conditional jump instructions except that a register value is used to determine branching. The B register is decremented, and if a non zero value remains, the value of the displacement e is added to the Program Counter (PC). The next instruction is fetched from the location designated by the new contents of the PC. The jump is measured from the address of the instruction Op Code and has a range of -126 to +129 bytes. The assembler automatically adjusts for the twice incremented PC.</Description>
    </Encoding>
  </Opcode>
  <Opcode Value='17' Function='RL-CY' Group='Logical' Length='1'>
    <Encoding Preferred='true' Platform='z80'>
      <Mnemonic>RLA</Mnemonic>
      <Arguments>
        <Arg encoding='Direct' hidden='true'>ByteReg-A</Arg>
      </Arguments>
      <Status>Documented</Status>
      <Cycles>1(4)</Cycles>
      <Flags>--0-0C</Flags>
      <Description>The contents of the Accumulator (register A) are rotated left 1-bit position through the Carry flag. The previous content of the Carry flag is copied to bit 0. Bit 0 is the least-significant bit.</Description>
    </Encoding>
    <Encoding Preferred='false' Platform='z80'>
      <Mnemonic>RL</Mnemonic>
      <Arguments>
        <Arg encoding='Direct'>ByteReg-A</Arg>
      </Arguments>
      <Status>Documented</Status>
      <Cycles>1(4)</Cycles>
      <Flags>--0-0C</Flags>
      <Description>The contents of the Accumulator (register A) are rotated left 1-bit position through the Carry flag. The previous content of the Carry flag is copied to bit 0. Bit 0 is the least-significant bit.</Description>
    </Encoding>
  </Opcode>
  <Opcode Value='18' Function='JMPR' Group='Branch' Length='2'>
    <Encoding Platform='z80'>
      <Mnemonic>JR</Mnemonic>
      <Arguments>
        <Arg encoding='ByteImmidate'>Displacment</Arg>
      </Arguments>
      <Status>Documented</Status>
      <Cycles>3(12)</Cycles>
      <Flags>------</Flags>